facility,readmission,healthcareProgram,visitDateType,comment
Tokyo CURA Healthcare Center,check,Medicare,valid,The user successfully makes an appointment by filling in all valid fields.
Hongkong CURA Healthcare Center,check,Medicaid,empty,The user prevent booking without a visit date
Seoul CURA Healthcare Center,check,Medicare,past,The user is prevented from booking an appointment with a past date.
Tokyo CURA Healthcare Center,check,Empty,valid,The user successfully books an appointment without selecting a healthcare program.
Tokyo CURA Healthcare Center,uncheck,None,valid,The user successfully books an appointment without selecting a healthcare program.
